Product ID,Product Name,Category
FUR-FU-10000820,Tensor Brushed Steel Torchiere Floor Lamp,Furnishings
FUR-FU-10002240,Nu-Dell EZ-Mount Plastic Wall Frames,Furnishings
FUR-FU-10001057,Tensor Track Tree Floor Lamp,Furnishings
FUR-CH-10002073,Hon Olson Stacker Chairs,Chairs
FUR-FU-10000277,Deflect-o DuraMat Antistatic Studded Beveled Mat for Medium Pile Carpeting,Furnishings
FUR-FU-10003806,"Tenex Chairmat w/ Average Lip, 45"" x 53""",Furnishings
FUR-FU-10003374,Electrix Fluorescent Magnifier Lamps & Weighted Base,Furnishings
FUR-FU-10002506,"Tensor ""Hersey Kiss"" Styled Floor Lamp",Furnishings
FUR-BO-10001567,"Bush Westfield Collection Bookcases, Dark Cherry Finish, Fully Assembled",Bookcases
FUR-FU-10001379,"Executive Impressions 16-1/2"" Circular Wall Clock",Furnishings
FUR-FU-10002030,"Executive Impressions 14"" Contract Wall Clock with Quartz Movement",Furnishings
FUR-CH-10002317,Global Enterprise Series Seating Low-Back Swivel/Tilt Chairs,Chairs
FUR-CH-10002780,Office Star - Task Chair with Contemporary Loop Arms,Chairs
